Imm.M0_like1.index	Imm.M0_like1.Term	Imm.M0_like1.NES	Imm.M0_like1.FDR q-val	Imm.M0_like2.index	Imm.M0_like2.Term	Imm.M0_like2.NES	Imm.M0_like2.FDR q-val	Imm.Interferon.index	Imm.Interferon.Term	Imm.Interferon.NES	Imm.Interferon.FDR q-val	Imm.1.2.12.index	Imm.1.2.12.Term	Imm.1.2.12.NES	Imm.1.2.12.FDR q-val	Imm.1.2.13.index	Imm.1.2.13.Term	Imm.1.2.13.NES	Imm.1.2.13.FDR q-val	Imm.Proliferation.index	Imm.Proliferation.Term	Imm.Proliferation.NES	Imm.Proliferation.FDR q-val	Imm.1.2.4.index	Imm.1.2.4.Term	Imm.1.2.4.NES	Imm.1.2.4.FDR q-val	Imm.1.2.5.index	Imm.1.2.5.Term	Imm.1.2.5.NES	Imm.1.2.5.FDR q-val
0	chemical synaptic transmission (GO:0007268)	2.7550561710959767	0.0	0.0	central nervous system neuron development (GO:0021954)	-1.9251581061311025	0.0478654859445327	0.0	cellular response to type I interferon (GO:0071357)	2.3886706118390486	0.0	0.0	regulation of T cell proliferation (GO:0042129)	2.086612121441272	0.0	0.0	regulation of immune response (GO:0050776)	2.164007225418011	0.000994734872192	0.0	microtubule cytoskeleton organization involved in mitosis (GO:1902850)	2.1682217438781737	0.0	0.0	SRP-dependent cotranslational protein targeting to membrane (GO:0006614)	2.592563805469111	0.0	0.0	T cell activation (GO:0042110)	1.960830264178339	0.0245035210966067
1	anterograde trans-synaptic signaling (GO:0098916)	2.720089488171121	0.0	1.0	regulation of synaptic transmission, glutamatergic (GO:0051966)	-1.9257795073345592	0.0499158231332853	1.0	type I interferon signaling pathway (GO:0060337)	2.3886706118390486	0.0	1.0	triglyceride catabolic process (GO:0019433)	2.07058608104248	0.0	1.0	positive regulation of immune effector process (GO:0002699)	2.049688419628742	0.0089526138497284	1.0	mitotic sister chromatid segregation (GO:0000070)	2.1335344117996464	0.0	1.0	cotranslational protein targeting to membrane (GO:0006613)	2.554754964095296	0.0	1.0	regulation of sequestering of triglyceride (GO:0010889)	1.9557897177957495	0.0132727405939953
2	cell-cell adhesion via plasma-membrane adhesion molecules (GO:0098742)	2.5423528135689395	0.0	2.0	regulation of release of sequestered calcium ion into cytosol by sarcoplasmic reticulum (GO:0010880)	-1.943243648829348	0.045946980926969	2.0	defense response to symbiont (GO:0140546)	2.386960553647076	0.0	2.0	cholesterol transport (GO:0030301)	2.009591755630172	0.0027505875224721	2.0	positive regulation of antigen receptor-mediated signaling pathway (GO:0050857)	2.00820674847639	0.0175736494087262	2.0	mitotic spindle organization (GO:0007052)	2.119044791501288	0.0	2.0	cytoplasmic translation (GO:0002181)	2.5205063920912734	0.0	2.0	negative regulation of osteoclast differentiation (GO:0045671)	1.8799869034107024	0.0408392018276779
3	regulation of synapse assembly (GO:0051963)	2.518011636488419	0.0	3.0	synapse assembly (GO:0007416)	-1.9435484452721488	0.0483668971591008	3.0	defense response to virus (GO:0051607)	2.3678593784740376	0.0	3.0	acylglycerol catabolic process (GO:0046464)	1.996642076031565	0.0030944109627811	3.0	leukocyte cell-cell adhesion (GO:0007159)	2.0028912648368564	0.0144236556467847	3.0	chromosome condensation (GO:0030261)	2.08003309971164	0.0	3.0	protein targeting to ER (GO:0045047)	2.486585225326758	0.0	3.0	innate immune response in mucosa (GO:0002227)	1.8634134331895005	0.04819025815666
4	modulation of chemical synaptic transmission (GO:0050804)	2.513799663135768	0.0	4.0	synaptic membrane adhesion (GO:0099560)	-1.9646403668301369	0.0385874499703528	4.0	positive regulation of cytokine-mediated signaling pathway (GO:0001961)	2.324034665071829	0.0	4.0	cholesterol efflux (GO:0033344)	1.9791013390121417	0.0049510575404499	4.0	regulation of T cell mediated cytotoxicity (GO:0001914)	2.0009037931587064	0.012135765440743	4.0	centromere complex assembly (GO:0034508)	2.0507243064847995	0.0	4.0	nuclear-transcribed mRNA catabolic process, nonsense-mediated decay (GO:0000184)	2.4514942412352294	0.0	4.0	positive regulation of nervous system development (GO:0051962)	-2.331623934360349	0.0089123188965825
5	glutamate receptor signaling pathway (GO:0007215)	2.476806595503385	0.0	5.0	cAMP-mediated signaling (GO:0019933)	-1.96465585651431	0.0411599466350429	5.0	negative regulation of viral process (GO:0048525)	2.2986339541635634	0.0	5.0	intestinal lipid absorption (GO:0098856)	1.9624932666490311	0.0079079391271075	5.0	interferon-gamma-mediated signaling pathway (GO:0060333)	1.9981709594793529	0.0107762944487472	5.0	sister chromatid segregation (GO:0000819)	2.0405977504468065	0.0	5.0	regulation of humoral immune response (GO:0002920)	2.3519072979384053	0.0				
6	synapse assembly (GO:0007416)	2.4052730597175245	0.0	6.0	receptor clustering (GO:0043113)	-1.9780805119284364	0.0375742503494134	6.0	regulation of viral genome replication (GO:0045069)	2.2945122858393945	0.0	6.0	fatty acid transport (GO:0015908)	1.9579473785760524	0.0075149980524686	6.0	T cell activation (GO:0042110)	1.993129485424209	0.0103736636671456	6.0	mitotic metaphase plate congression (GO:0007080)	2.03559762755976	0.0	6.0	regulation of immune effector process (GO:0002697)	2.3474841195386165	0.0				
7	neurotransmitter secretion (GO:0007269)	2.3675824071813487	0.0	7.0	anterograde trans-synaptic signaling (GO:0098916)	-1.9916234558791197	0.0336588348651052	7.0	negative regulation of viral genome replication (GO:0045071)	2.2279093588176964	0.0	7.0	regulation of macrophage derived foam cell differentiation (GO:0010743)	1.919757500441488	0.0189532671470348	7.0	Fc-gamma receptor signaling pathway involved in phagocytosis (GO:0038096)	1.9764156275699296	0.0151697068009287	7.0	mitotic nuclear division (GO:0140014)	2.014630360972097	0.0	7.0	regulation of complement activation (GO:0030449)	2.222119913755724	0.0004021752803393				
8	synaptic transmission, glutamatergic (GO:0035249)	2.3394048607618223	0.0	8.0	cGMP-mediated signaling (GO:0019934)	-2.002207216878257	0.0313347724577527	8.0	interferon-gamma-mediated signaling pathway (GO:0060333)	2.1795926042844416	0.0	8.0	vacuolar acidification (GO:0007035)	1.9191686245355029	0.0170765642020147	8.0	immune response-regulating cell surface receptor signaling pathway (GO:0002768)	1.975666416410741	0.0137052360168682	8.0	positive regulation of cell cycle process (GO:0090068)	2.0080961399564363	0.0	8.0	receptor-mediated endocytosis (GO:0006898)	2.211847240932145	0.0003574891380794				
9	regulation of neurotransmitter receptor activity (GO:0099601)	2.3104907385922937	0.0	9.0	chemical synaptic transmission (GO:0007268)	-2.0186980856951267	0.0274516211627092	9.0	negative regulation of cytokine-mediated signaling pathway (GO:0001960)	2.168437212987317	0.0	9.0	iron ion transport (GO:0006826)	1.917462383369133	0.016503525134833	9.0	regulation of B cell proliferation (GO:0030888)	1.966882282088506	0.0159157579550728	9.0	mitotic chromosome condensation (GO:0007076)	2.0054304112982666	0.0	9.0	nuclear-transcribed mRNA catabolic process (GO:0000956)	2.194191461324584	0.0007507271899667				
10	regulation of cation channel activity (GO:2001257)	2.306383301092397	0.0	10.0	modulation of excitatory postsynaptic potential (GO:0098815)	-2.02701526194835	0.0261577230951675	10.0	cellular response to interferon-gamma (GO:0071346)	2.16396161568126	0.0	10.0	intracellular pH reduction (GO:0051452)	1.913613601437389	0.0164097551056578	10.0	Fc-gamma receptor signaling pathway (GO:0038094)	1.9652474505289037	0.0150114535258073	10.0	cytoskeleton-dependent cytokinesis (GO:0061640)	2.0020702165624007	0.0	10.0	peptide biosynthetic process (GO:0043043)	2.1758311059502065	0.0015599526025283				
11	calcium-dependent cell-cell adhesion via plasma membrane cell adhesion molecules (GO:0016339)	2.303339569616861	5.602058319770175e-05	11.0	neuron cell-cell adhesion (GO:0007158)	-2.043463767797749	0.0235077576835655	11.0	negative regulation of innate immune response (GO:0045824)	2.16372924593028	0.0	11.0	regulation of sequestering of triglyceride (GO:0010889)	1.9008642772119524	0.0194260243774597	11.0	Fc receptor mediated stimulatory signaling pathway (GO:0002431)	1.962142418216805	0.0151697068009287	11.0	chromatin remodeling at centromere (GO:0031055)	1.9956552676601196	0.0	11.0	regulation of B cell activation (GO:0050864)	2.1003402791935915	0.0087584838829458				
12	synapse organization (GO:0050808)	2.2937693289037333	5.171130756710931e-05	12.0	positive regulation of calcium ion transmembrane transporter activity (GO:1901021)	-2.0609534229646567	0.0213974021642454	12.0	regulation of type I interferon-mediated signaling pathway (GO:0060338)	2.0912589242844635	0.0	12.0	reverse cholesterol transport (GO:0043691)	1.8994269834298396	0.0186458096475277	12.0	innate immune response (GO:0045087)	1.9515809042955732	0.0185173722361904	12.0	CENP-A containing chromatin organization (GO:0061641)	1.9851412291464183	6.438983425915943e-05	12.0	positive regulation of substrate adhesion-dependent cell spreading (GO:1900026)	2.053649862462382	0.0202118858837212				
13	positive regulation of synapse assembly (GO:0051965)	2.277423244137306	4.801764274088722e-05	13.0	regulation of synapse assembly (GO:0051963)	-2.072836234300751	0.0199205349201643	13.0	positive regulation of response to biotic stimulus (GO:0002833)	2.050249302120833	0.0005021851020325	13.0	long-chain fatty acid transport (GO:0015909)	1.8972913389196409	0.0183454364222028	13.0	innate immune response activating cell surface receptor signaling pathway (GO:0002220)	1.9397934096687868	0.0237315319508675	13.0	CENP-A containing nucleosome assembly (GO:0034080)	1.9851412291464183	6.438983425915943e-05								
14	positive regulation of nervous system development (GO:0051962)	2.259295072574094	4.48164665581614e-05	14.0	regulation of NMDA receptor activity (GO:2000310)	-2.113064686816292	0.0134635339460421	14.0	positive regulation of innate immune response (GO:0045089)	2.031155356725832	0.0011382862312736	14.0	secretory granule organization (GO:0033363)	1.8926994004875048	0.0194604067214906	14.0	regulation of T cell receptor signaling pathway (GO:0050856)	1.937369782243471	0.0232104803511478	14.0	mitotic cytokinesis (GO:0000281)	1.976072268557812	0.0002403887145675								
15	signal release from synapse (GO:0099643)	2.257115904212668	4.201543739827632e-05	15.0	regulation of neurotransmitter receptor activity (GO:0099601)	-2.146896164357968	0.0073087755707085	15.0	response to interferon-gamma (GO:0034341)	2.0185841686823247	0.0013182358928353	15.0	transferrin transport (GO:0033572)	1.8824184093369245	0.0230791484307431	15.0	stimulatory C-type lectin receptor signaling pathway (GO:0002223)	1.937126233531254	0.0206553770519878	15.0	regulation of cell cycle process (GO:0010564)	1.9644903370058904	0.0003943877348373								
16	neuron cell-cell adhesion (GO:0007158)	2.246736314682952	7.90878821614613e-05	16.0	regulation of MHC class II biosynthetic process (GO:0045346)	-2.164686514174797	0.0072126074710939	16.0	regulation of interferon-gamma-mediated signaling pathway (GO:0060334)	2.013709186564719	0.001536095606217	16.0	positive regulation of leukocyte migration (GO:0002687)	1.879877139838676	0.0234204437575204	16.0	cellular response to lectin (GO:1990858)	1.937126233531254	0.0206553770519878	16.0	regulation of mitotic nuclear division (GO:0007088)	1.963444963077968	0.0003711884563175								
17	regulation of potassium ion transport (GO:0043266)	2.230586269184786	7.4694110930269e-05	17.0	glutamate receptor signaling pathway (GO:0007215)	-2.230144861045612	0.0028850429884375	17.0	negative regulation of type I interferon-mediated signaling pathway (GO:0060339)	2.01287072415098	0.0015065553060975	17.0	insulin receptor signaling pathway (GO:0008286)	1.8729790684694867	0.0259586697433311	17.0	inflammatory response (GO:0006954)	1.9171921716049352	0.0303394136018575	17.0	DNA replication-independent nucleosome assembly (GO:0006336)	1.9588477012229752	0.0004006478576125								
18	neurotransmitter transport (GO:0006836)	2.198038219526733	0.0003538142096696	18.0	regulation of cation channel activity (GO:2001257)	-2.2415868002746686	0.0038467239845834	18.0	NAD biosynthesis via nicotinamide riboside salvage pathway (GO:0034356)	1.984333954063907	0.0031716953812579	18.0	positive regulation of cholesterol transport (GO:0032376)	1.8603169081406343	0.0320841557719945	18.0	regulation of interleukin-8 production (GO:0032677)	1.914684379553568	0.0298420461657615	18.0	histone exchange (GO:0043486)	1.9575820635464904	0.0003795611282645								
19	nervous system development (GO:0007399)	2.163902563295979	0.0007730840481282	19.0	cyclic-nucleotide-mediated signaling (GO:0019935)	-2.295777320536419	0.0028850429884375	19.0	positive regulation of type I interferon production (GO:0032481)	1.9758553328372088	0.0033646401836178	19.0	cellular response to insulin stimulus (GO:0032869)	1.8590091469609131	0.0315114183043218	19.0	regulation of neutrophil chemotaxis (GO:0090022)	1.908081174135148	0.0326273038078992	19.0	positive regulation of cytokinesis (GO:0032467)	1.9554077430291696	0.0004507288398141								
20	presynapse assembly (GO:0099054)	2.156288513032828	0.0009283410929904					20.0	protein mono-ADP-ribosylation (GO:0140289)	1.953516948606423	0.0053088139357722	20.0	negative regulation of T cell proliferation (GO:0042130)	1.8565481824203327	0.0316808741427598	20.0	positive regulation of interleukin-2 production (GO:0032743)	1.8949500486787787	0.0405946564508851	20.0	kinetochore organization (GO:0051383)	1.9484429941692336	0.0006438983425915								
21	cell junction assembly (GO:0034329)	2.152798923538346	0.000916700452326					21.0	protein ADP-ribosylation (GO:0006471)	1.9438028441899355	0.0061631807976717	21.0	negative regulation of macrophage derived foam cell differentiation (GO:0010745)	1.8564911420703252	0.0303346044381732					21.0	positive regulation of cell division (GO:0051781)	1.9367136109673944	0.0009014576796282								
22	regulation of postsynaptic membrane potential (GO:0060078)	2.151840907697751	0.0008768439109205					22.0	regulation of type I interferon production (GO:0032479)	1.9348682694747923	0.0072489327771649	22.0	positive regulation of cholesterol efflux (GO:0010875)	1.851831424448142	0.0316616541988916					22.0	mitotic spindle assembly (GO:0090307)	1.9184272542953729	0.0024692101659382								
23	potassium ion transmembrane transport (GO:0071805)	2.1472400307913424	0.000924339622762					23.0	positive regulation of tyrosine phosphorylation of STAT protein (GO:0042531)	1.9318957740471825	0.0072816839794714	23.0	cellular response to glucocorticoid stimulus (GO:0071385)	1.8512035612450537	0.0308581537677347					23.0	negative regulation of mitotic metaphase/anaphase transition (GO:0045841)	1.9176189789306	0.0024790086189776								
24	positive regulation of synaptic transmission (GO:0050806)	2.142270641795744	0.0010755951973958					24.0	positive regulation of interferon-beta production (GO:0032728)	1.9259691584124936	0.0076332135508942	24.0	response to glucocorticoid (GO:0051384)	1.8473390338914348	0.0320580975744132					24.0	apoptotic nuclear changes (GO:0030262)	1.906882574167868	0.0034976557969575								
25	regulation of dendrite development (GO:0050773)	2.1398314183100555	0.0010600818051257					25.0	regulation of RIG-I signaling pathway (GO:0039535)	1.9210773718835223	0.008730294850719	25.0	regulation of cholesterol efflux (GO:0010874)	1.8434052962953449	0.033721145107231					25.0	regulation of mitotic metaphase/anaphase transition (GO:0030071)	1.9062116053398437	0.0034324734724305								
26	cell-cell junction organization (GO:0045216)	2.132491937432989	0.0011453097009307					26.0	positive regulation of defense response to virus by host (GO:0002230)	1.9098828269048973	0.0113456634162901	26.0	negative regulation of lipid storage (GO:0010888)	1.8419598959453936	0.0339239127771568					26.0	establishment of mitotic spindle localization (GO:0040001)	1.9046204895079712	0.0036058307185129								
27	regulation of release of sequestered calcium ion into cytosol by sarcoplasmic reticulum (GO:0010880)	2.1298537880570314	0.0011764322471517					27.0	NAD biosynthetic process (GO:0009435)	1.899236385618432	0.0145274975945119	27.0	phagosome maturation (GO:0090382)	1.8410174952447609	0.033743814784614					27.0	mitotic spindle assembly checkpoint signaling (GO:0007094)	1.897924298278405	0.0039964623796851								
28	potassium ion transport (GO:0006813)	2.127732061130004	0.0011358656179396					28.0	detection of light stimulus involved in sensory perception (GO:0050962)	1.8972671315838452	0.0142620568977233	28.0	negative regulation of lymphocyte proliferation (GO:0050672)	1.837598904815901	0.0347854473747127					28.0	mitotic spindle checkpoint signaling (GO:0071174)	1.897924298278405	0.0039964623796851								
29	regulation of synaptic transmission, glutamatergic (GO:0051966)	2.114640963354758	0.0013444939967448					29.0	detection of light stimulus involved in visual perception (GO:0050908)	1.8972671315838452	0.0142620568977233	29.0	positive regulation of vascular endothelial growth factor production (GO:0010575)	1.8362583124629184	0.0344854910629949					29.0	spindle assembly checkpoint signaling (GO:0071173)	1.897924298278405	0.0039964623796851								
30	modulation of excitatory postsynaptic potential (GO:0098815)	2.1144135324600564	0.0013011232226562					30.0	positive regulation of interferon-alpha production (GO:0032727)	1.896244648043877	0.0140611828569103	30.0	phagosome acidification (GO:0090383)	1.836009473062337	0.0334728755758912					30.0	regulation of nuclear division (GO:0051783)	1.89106199974681	0.0053505875177933								
31	regulation of presynapse organization (GO:0099174)	2.1099940752799444	0.0012630095120936					31.0	response to interferon-beta (GO:0035456)	1.887161433176684	0.0168232009180891	31.0	positive regulation of p38MAPK cascade (GO:1900745)	1.8340391794115292	0.0336839526677745					31.0	microtubule depolymerization (GO:0007019)	1.8872069355045984	0.0060848393374905								
32	regulation of presynapse assembly (GO:1905606)	2.1099940752799444	0.0012630095120936					32.0	regulation of mesenchymal cell proliferation (GO:0010464)	1.881926089614805	0.0183525828197336	32.0	neutrophil activation involved in immune response (GO:0002283)	1.8323067327804856	0.0340385205905931					32.0	regulation of cytokinesis (GO:0032465)	1.8792578201531829	0.00786726702221								
33	positive regulation of excitatory postsynaptic potential (GO:2000463)	2.099878524657696	0.0016410735548503					33.0	regulation of innate immune response (GO:0045088)	1.8813306472862024	0.0180491233730509	33.0	toll-like receptor signaling pathway (GO:0002224)	1.8320101060200211	0.0332800865310879					33.0	regulation of attachment of spindle microtubules to kinetochore (GO:0051988)	1.8760475296532493	0.0082721998836473								
34	homophilic cell adhesion via plasma membrane adhesion molecules (GO:0007156)	2.0965044389516367	0.0016325998531901					34.0	negative regulation of leukocyte apoptotic process (GO:2000107)	1.875731606634884	0.0199152263320322	34.0	acute inflammatory response (GO:0002526)	1.8293031789589256	0.0338616971070056					34.0	establishment of spindle orientation (GO:0051294)	1.8625994805226067	0.0127749431170172								
35	axonogenesis (GO:0007409)	2.091590725612294	0.0016619439681984					35.0	regulation of tyrosine phosphorylation of STAT protein (GO:0042509)	1.8736383089007875	0.0202268999429762	35.0	neutrophil mediated immunity (GO:0002446)	1.825629420399326	0.0353565104451111					35.0	establishment of mitotic spindle orientation (GO:0000132)	1.8602662157699728	0.0132965007745164								
36	regulation of NMDA receptor activity (GO:2000310)	2.088796917993593	0.0016715330770341					36.0	cellular response to virus (GO:0098586)	1.8577742129329615	0.0271451406504061	36.0	neutrophil degranulation (GO:0043312)	1.8244227407544888	0.0351257460640027					36.0	resolution of meiotic recombination intermediates (GO:0000712)	1.859193304524516	0.0131564093783579								
37	positive regulation of cell communication (GO:0010647)	2.0859297898214573	0.0016629267854475					37.0	interleukin-27-mediated signaling pathway (GO:0070106)	1.857547546916454	0.0266686719974108	37.0	regulation of vascular endothelial growth factor production (GO:0010574)	1.819927801059589	0.0372957952882576					37.0	interstrand cross-link repair (GO:0036297)	1.8581947344935423	0.0135693103354565								
38	regulation of cation transmembrane transport (GO:1904062)	2.085854931554899	0.0016202876371027					38.0	regulation of interferon-alpha production (GO:0032647)	1.8538676243057832	0.0280193533851986	38.0	wound healing, spreading of cells (GO:0044319)	1.8188916447725625	0.0368684519839059					38.0	recombinational repair (GO:0000725)	1.8562642667103997	0.0139148082855434								
39	heterophilic cell-cell adhesion via plasma membrane cell adhesion molecules (GO:0007157)	2.083840007097635	0.0016301989710531					39.0	regulation of interferon-beta production (GO:0032648)	1.8496053228931817	0.0294531562342068	39.0	sterol homeostasis (GO:0055092)	1.814575226239236	0.0397373941137152					39.0	protein localization to chromosome, centromeric region (GO:0071459)	1.853118262252392	0.0149416610398379								
40	synaptic membrane adhesion (GO:0099560)	2.0769042787605456	0.0018691745808403					40.0	cellular response to interferon-beta (GO:0035458)	1.838031743471021	0.0352999381477488	40.0	response to lipid (GO:0033993)	1.8113678542169025	0.0416110222149601					40.0	negative regulation of cell cycle process (GO:0010948)	1.8517565201213948	0.0155006747350708								
41	regulation of trans-synaptic signaling (GO:0099177)	2.0682634816111243	0.0021607939233399					41.0	regulation of defense response to virus by host (GO:0050691)	1.823892027026432	0.0452444863355007	41.0	pattern recognition receptor signaling pathway (GO:0002221)	1.8033256384381864	0.0468582231506867					41.0	regulation of cyclin-dependent protein kinase activity (GO:1904029)	1.849515579928498	0.0160974585647898								
42	adherens junction organization (GO:0034332)	2.049983826186062	0.0031892648294877					42.0	positive regulation of response to cytokine stimulus (GO:0060760)	1.8179767764853836	0.0490739953195493	42.0	secondary alcohol metabolic process (GO:1902652)	1.8027577393866876	0.0460803368953696					42.0	regulation of chromosome segregation (GO:0051983)	1.8435859497786804	0.0187419340834334								
43	heart contraction (GO:0060047)	2.033433590857295	0.0038348635588972					43.0	regulation of protein kinase C signaling (GO:0090036)	1.8168372866880844	0.0490771804259046	43.0	triglyceride metabolic process (GO:0006641)	1.7972347549791372	0.0499559830430813					43.0	regulation of cell cycle G2/M phase transition (GO:1902749)	1.8428816678451487	0.0186847591777488								
44	chloride transmembrane transport (GO:1902476)	2.0293680715900666	0.0039886655236763									44.0	synaptic transmission, glutamatergic (GO:0035249)	-2.091787926750687	0.0147206640129375					44.0	positive regulation of mitotic cell cycle phase transition (GO:1901992)	1.8359003612245384	0.0223361180618995								
45	neuronal action potential (GO:0019228)	2.0186256695857288	0.0045595883367868									45.0	regulation of NMDA receptor activity (GO:2000310)	-2.099295255895071	0.0164157707780636					45.0	mitotic cell cycle checkpoint signaling (GO:0007093)	1.8338365921795017	0.0231635429852297								
46	cardiac muscle cell action potential (GO:0086001)	2.0135113984948467	0.0049631852858559									46.0	regulation of ventricular cardiac muscle cell action potential (GO:0098911)	-2.1023436671428417	0.01962755201725					46.0	cell cycle checkpoint signaling (GO:0000075)	1.8313583165390024	0.0242242776461799								
47	heart process (GO:0003015)	2.0066464555042622	0.0054620068617759									47.0	cell-cell adhesion via plasma-membrane adhesion molecules (GO:0098742)	-2.1275879705864	0.0154641318923788					47.0	DNA-dependent DNA replication maintenance of fidelity (GO:0045005)	1.83045349726772	0.0244144788232646								
48	detection of calcium ion (GO:0005513)	2.006007128235708	0.0054191339664715									48.0	regulation of heart rate by cardiac conduction (GO:0086091)	-2.1740480540916662	0.0111520181916193					48.0	microtubule polymerization or depolymerization (GO:0031109)	1.822546204294481	0.0297481034277316								
49	axon development (GO:0061564)	2.005833958564552	0.0053510861070444									49.0	cellular potassium ion homeostasis (GO:0030007)	-2.379038420722185	0.0008921614553295					49.0	protein localization to kinetochore (GO:0034501)	1.8210380113919005	0.0303430654962862								
50	regulation of cardiac muscle cell contraction (GO:0086004)	1.999899743377605	0.0057734153977866																	50.0	attachment of mitotic spindle microtubules to kinetochore (GO:0051315)	1.8181291887957325	0.0325055033889474								
51	chemical synaptic transmission, postsynaptic (GO:0099565)	1.995039146468428	0.0060502229853517																	51.0	retrograde vesicle-mediated transport, Golgi to endoplasmic reticulum (GO:0006890)	1.812350487474282	0.0376531938490869								
52	muscle cell differentiation (GO:0042692)	1.992815649634204	0.0061136425135001																	52.0	double-strand break repair via homologous recombination (GO:0000724)	1.8113556807336493	0.037844213908921								
53	synaptic vesicle exocytosis (GO:0016079)	1.9905927144844415	0.0062494072811658																	53.0	regulation of chromosome organization (GO:0033044)	1.8107706134309527	0.0376942859370471								
54	neuropeptide signaling pathway (GO:0007218)	1.9671795163275807	0.0090936684870742																	54.0	protein depolymerization (GO:0051261)	1.808755338727901	0.038844630922162								
55	synaptic vesicle cycle (GO:0099504)	1.9625995915481305	0.0094474712092695																	55.0	positive regulation of G2/M transition of mitotic cell cycle (GO:0010971)	1.8078139576509664	0.038907557351097								
56	central nervous system development (GO:0007417)	1.9606264108934564	0.0094704270121588																	56.0	positive regulation of mitotic nuclear division (GO:0045840)	1.8041361843819068	0.0412772726987664								
