199	T cell activation (GO:0042110)	-1.8145483497307504	0.0301081800275649																																				
200	positive regulation of inflammatory response (GO:0050729)	-1.8168293578886288	0.029466409863099																																				
201	natural killer cell mediated immunity (GO:0002228)	-1.8194468336593947	0.0287098115186797																																				
202	regulation of RNA metabolic process (GO:0051252)	-1.820513526251128	0.0285971401803296																																				
203	polarized epithelial cell differentiation (GO:0030859)	-1.8206766973256925	0.0288319625622005																																				
204	regulation of interferon-gamma-mediated signaling pathway (GO:0060334)	-1.822631243974565	0.0283535941646062																																				
205	regulation of erythrocyte differentiation (GO:0045646)	-1.824524338386216	0.0280560760004946																																				
206	regulation of cytokine production involved in inflammatory response (GO:1900015)	-1.8246665449153852	0.0282804913959426																																				
207	regulation of establishment of cell polarity (GO:2000114)	-1.826086556918485	0.0280975329041496																																				
208	DNA replication (GO:0006260)	-1.8265233987121905	0.0281800316351075																																				
209	recombinational repair (GO:0000725)	-1.827442976917992	0.0282394738893378																																				
210	positive regulation of immune effector process (GO:0002699)	-1.829990092058116	0.0276886947163855																																				
211	positive regulation of chemokine production (GO:0032722)	-1.830423218718743	0.0277695471004568																																				
212	regulation of inflammatory response (GO:0050727)	-1.8334115026129836	0.0268332438080449																																				
213	phospholipid transport (GO:0015914)	-1.8360418078844276	0.0260961892350071																																				
214	positive regulation of cholesterol efflux (GO:0010875)	-1.836389689861319	0.0262148452184487																																				
215	positive regulation of B cell proliferation (GO:0030890)	-1.8374142449439423	0.026099474667367																																				
216	lysosome localization (GO:0032418)	-1.8374276990931635	0.0263668311415609																																				
217	antigen processing and presentation of exogenous peptide antigen via MHC class I (GO:0042590)	-1.839632844156483	0.0255926610146249																																				
218	response to muramyl dipeptide (GO:0032495)	-1.8406708500755684	0.0254394999031944																																				
219	lymphocyte differentiation (GO:0030098)	-1.840693718742766	0.0257221610132299																																				
220	regulation of double-strand break repair via homologous recombination (GO:0010569)	-1.8521629679384428	0.022291326327463																																				
221	positive regulation of interleukin-8 production (GO:0032757)	-1.8542009546735725	0.0219831265960307																																				
222	response to exogenous dsRNA (GO:0043330)	-1.855485000738416	0.0218098329129951																																				
223	negative regulation of type I interferon production (GO:0032480)	-1.860032188494091	0.0207131993267539																																				
224	regulation of response to cytokine stimulus (GO:0060759)	-1.8631815749696856	0.0199686259708456																																				
225	regulation of interleukin-1 beta production (GO:0032651)	-1.863196001688256	0.0202063477085938																																				
226	fatty acid transport (GO:0015908)	-1.863898045650035	0.0202414300190259																																				
227	positive regulation of lymphocyte differentiation (GO:0045621)	-1.8640312987530423	0.0204581469078595																																				
228	double-strand break repair via homologous recombination (GO:0000724)	-1.8728315526965156	0.0183010750716683																																				
229	positive regulation of cytokine-mediated signaling pathway (GO:0001961)	-1.8785034477575029	0.016939360704617																																				
230	cellular response to cadmium ion (GO:0071276)	-1.880003989642879	0.0166377621727496																																				
231	regulation of interleukin-10 production (GO:0032653)	-1.88007553588098	0.016835229347178																																				
232	positive regulation of response to external stimulus (GO:0032103)	-1.8832065632167172	0.0162196248776406																																				
233	purinergic nucleotide receptor signaling pathway (GO:0035590)	-1.8834140768918664	0.0164330409944517																																				
234	response to cadmium ion (GO:0046686)	-1.883927225255824	0.0165368514347595																																				
235	myeloid leukocyte differentiation (GO:0002573)	-1.89002028655002	0.015307983706062																																				
236	positive regulation of I-kappaB kinase/NF-kappaB signaling (GO:0043123)	-1.89216747027462	0.0148746374889008																																				
237	type I interferon signaling pathway (GO:0060337)	-1.895531692165244	0.0143263103295404																																				
238	cellular response to type I interferon (GO:0071357)	-1.895531692165244	0.0143263103295404																																				
239	regulation of platelet activation (GO:0010543)	-1.8958703326897657	0.0145944537598315																																				
240	regulation of cytokine production (GO:0001817)	-1.8968238957018904	0.0146985482287562																																				
241	superoxide metabolic process (GO:0006801)	-1.8971104032338897	0.0148602038247377																																				
242	regulation of extrinsic apoptotic signaling pathway via death domain receptors (GO:1902041)	-1.8979407038960272	0.0148607461085689																																				
243	regulation of necroptotic process (GO:0060544)	-1.8990482942793	0.0148238708080513																																				
244	cytokine-mediated signaling pathway (GO:0019221)	-1.9002813640091007	0.0146718311074559																																				
245	I-kappaB kinase/NF-kappaB signaling (GO:0007249)	-1.906308230904977	0.0138587750523188																																				
246	positive regulation of ERBB signaling pathway (GO:1901186)	-1.9074310452365653	0.013902280956228																																				
247	mitotic sister chromatid segregation (GO:0000070)	-1.9088451869343352	0.0137080955859399																																				
248	regulation of programmed necrotic cell death (GO:0062098)	-1.9090945924879232	0.0138720648955125																																				
249	regulation of cellular component size (GO:0032535)	-1.9123060237690035	0.0134238385650687																																				
250	regulation of myeloid cell differentiation (GO:0045637)	-1.9224693030286983	0.0114947811774296																																				
251	positive regulation of response to biotic stimulus (GO:0002833)	-1.925132955628386	0.0113734870854877																																				
252	plasma membrane invagination (GO:0099024)	-1.9251396495591997	0.0115730219466366																																				
253	positive regulation of reactive oxygen species metabolic process (GO:2000379)	-1.9273470523328489	0.0114267337478729																																				
254	bone development (GO:0060348)	-1.9282953669207383	0.0114323488504517																																				
255	regulation of interleukin-8 production (GO:0032677)	-1.9310242764130563	0.0111636557937177																																				
256	regulation of macrophage derived foam cell differentiation (GO:0010743)	-1.93212015529334	0.0111412110790071																																				
257	Fc-epsilon receptor signaling pathway (GO:0038095)	-1.934892045174117	0.0108090724642041																																				
258	positive regulation of interferon-beta production (GO:0032728)	-1.9352579985189056	0.0109483490281686																																				
259	Fc receptor signaling pathway (GO:0038093)	-1.9448394665722788	0.0092155063523386																																				
260	positive regulation of type I interferon production (GO:0032481)	-1.9448539501177744	0.0094035779105496																																				
261	B cell differentiation (GO:0030183)	-1.9458868341124964	0.0093678628023102																																				
262	defense response to symbiont (GO:0140546)	-1.9485187732271183	0.0091203602311947																																				
263	cellular macromolecule biosynthetic process (GO:0034645)	-1.9767766548136183	0.00561266122986																																				
264	defense response to virus (GO:0051607)	-1.97821594785868	0.005572677359323																																				
265	positive regulation of cellular catabolic process (GO:0031331)	-1.9785635819800795	0.0056712536045954																																				
266	positive regulation of B cell activation (GO:0050871)	-1.9852876712741503	0.0051136608601417																																				
267	antigen receptor-mediated signaling pathway (GO:0050851)	-1.9878953040278071	0.0049118778272709																																				
268	positive regulation of interleukin-1 beta production (GO:0032731)	-1.992660222714841	0.004429083351186																																				
269	regulation of interleukin-6 production (GO:0032675)	-1.99898173283258	0.0040147983438472																																				
270	positive regulation of defense response (GO:0031349)	-2.0021560581033824	0.0038009925148849																																				
271	regulation of sequestering of triglyceride (GO:0010889)	-2.0124836729614466	0.0030557979297298																																				
272	regulation of B cell activation (GO:0050864)	-2.0131253906333435	0.0031383870629658																																				
273	regulation of mast cell degranulation (GO:0043304)	-2.023213667974069	0.0026422177134721																																				
274	regulation of interferon-beta production (GO:0032648)	-2.0243859747849164	0.0025765299261613																																				
275	positive regulation of tumor necrosis factor superfamily cytokine production (GO:1903557)	-2.024576326381057	0.0026523102181072																																				
276	regulation of innate immune response (GO:0045088)	-2.0246937266775347	0.0027326832550195																																				
277	positive regulation of interleukin-1 production (GO:0032732)	-2.029436763203988	0.0025478527951338																																				
278	positive regulation of tumor necrosis factor production (GO:0032760)	-2.034926375676987	0.002351097789449																																				
279	positive regulation of immune response (GO:0050778)	-2.0365631169539977	0.0023059354590302																																				
280	regulation of defense response (GO:0031347)	-2.037357066850637	0.0023854504748588																																				
281	nuclear-transcribed mRNA catabolic process (GO:0000956)	-2.053230246450936	0.0018971025141256																																				
282	regulation of immune response (GO:0050776)	-2.0540920770263678	0.0019216128825251																																				
283	nuclear-transcribed mRNA catabolic process, nonsense-mediated decay (GO:0000184)	-2.058958409321206	0.0017104466316982																																				
284	positive regulation of interleukin-6 production (GO:0032755)	-2.0605086520222367	0.0017788644969661																																				
285	regulation of cholesterol storage (GO:0010885)	-2.0644932423431683	0.0016985685300892																																				
286	regulation of antigen receptor-mediated signaling pathway (GO:0050854)	-2.0698522301435087	0.0014501612747006																																				
287	cotranslational protein targeting to membrane (GO:0006613)	-2.08104118030704	0.0010107184641853																																				
288	SRP-dependent cotranslational protein targeting to membrane (GO:0006614)	-2.083569539372558	0.0009411981465429																																				
289	positive regulation of phagocytosis (GO:0050766)	-2.0947604288712567	0.0007411935404025																																				
290	cytoplasmic translation (GO:0002181)	-2.094766551127536	0.0007802037267395																																				
291	regulation of tumor necrosis factor production (GO:0032680)	-2.0991265335548626	0.0007549193467063																																				
292	regulation of B cell proliferation (GO:0030888)	-2.0994409411093446	0.0007993263671008																																				
293	positive regulation of cytokine production (GO:0001819)	-2.101508072850792	0.0008492842650446																																				
294	regulation of B cell receptor signaling pathway (GO:0050855)	-2.1103515419768653	0.0007411935404025																																				
295	B cell activation (GO:0042113)	-2.123441899236101	0.0006176612836688																																				
296	protein targeting to ER (GO:0045047)	-2.1304999183605946	0.0006651736901048																																				
297	vascular endothelial growth factor receptor signaling pathway (GO:0048010)	-2.150154004052234	0.0004117741891125																																				
298	toll-like receptor signaling pathway (GO:0002224)	-2.160948284321898	0.0003369061547284																																				
299	Fc receptor mediated stimulatory signaling pathway (GO:0002431)	-2.174360485261912	0.0003705967702012																																				
300	Fc-gamma receptor signaling pathway involved in phagocytosis (GO:0038096)	-2.188062104574395	0.000274516126075																																				
301	neutrophil mediated immunity (GO:0002446)	-2.188793783026415	0.0003088306418344																																				
302	neutrophil degranulation (GO:0043312)	-2.195856739118615	0.0001764746524768																																				
303	Fc-gamma receptor signaling pathway (GO:0038094)	-2.2001705006489782	0.0002058870945562																																				
304	neutrophil activation involved in immune response (GO:0002283)	-2.206442166081449	0.0002470645134675																																				
305	innate immune response (GO:0045087)	-2.210624571216763	0.0003088306418344																																				
306	B cell receptor signaling pathway (GO:0050853)	-2.222358020380671	0.0004117741891125																																				
307	pattern recognition receptor signaling pathway (GO:0002221)	-2.234900509546576	0.0006176612836688																																				
308	regulation of cytokine-mediated signaling pathway (GO:0001959)	-2.2577473554248453	0.0012353225673376																																				
