261	positive regulation of cellular catabolic process (GO:0031331)	-1.9775251763640012	0.0050183095322453																												
262	regulation of B cell activation (GO:0050864)	-1.9781427877549729	0.0051350144050882																												
263	positive regulation of B cell activation (GO:0050871)	-2.001392805799372	0.0037006528394211																												
264	antigen receptor-mediated signaling pathway (GO:0050851)	-2.0045989842949483	0.00364047962252																												
265	regulation of innate immune response (GO:0045088)	-2.005219524011796	0.003731491613083																												
266	regulation of defense response (GO:0031347)	-2.006949301652617	0.0036690233279731																												
267	positive regulation of defense response (GO:0031349)	-2.0156868193651376	0.0030514154991718																												
268	regulation of mast cell degranulation (GO:0043304)	-2.017745924253103	0.0029671901144908																												
269	regulation of interleukin-6 production (GO:0032675)	-2.02036953015152	0.002878285541772																												
270	regulation of immune response (GO:0050776)	-2.023534825571632	0.0027490563949985																												
271	regulation of sequestering of triglyceride (GO:0010889)	-2.024043500035768	0.002793630084661																												
272	positive regulation of tumor necrosis factor superfamily cytokine production (GO:1903557)	-2.024650966900653	0.002878285541772																												
273	positive regulation of interleukin-1 beta production (GO:0032731)	-2.030434499516667	0.0025827472941793																												
274	positive regulation of tumor necrosis factor production (GO:0032760)	-2.0329917215821487	0.0025864777909932																												
275	positive regulation of immune response (GO:0050778)	-2.035719996827824	0.0025493386227123																												
276	nuclear-transcribed mRNA catabolic process (GO:0000956)	-2.0451851575916757	0.0021268119766788																												
277	regulation of cholesterol storage (GO:0010885)	-2.0543158317726986	0.001894381810656																												
278	regulation of interferon-beta production (GO:0032648)	-2.056422235427985	0.001918857027848																												
279	nuclear-transcribed mRNA catabolic process, nonsense-mediated decay (GO:0000184)	-2.060145244854716	0.0019452149540547																												
280	cotranslational protein targeting to membrane (GO:0006613)	-2.0621390798157746	0.001924339476499																												
281	positive regulation of interleukin-1 production (GO:0032732)	-2.065233684099565	0.0018503264197105																												
282	positive regulation of interleukin-6 production (GO:0032755)	-2.069571245014275	0.0017162447950938																												
283	regulation of antigen receptor-mediated signaling pathway (GO:0050854)	-2.0703208157943327	0.0017942559221435																												
284	cytoplasmic translation (GO:0002181)	-2.072913189347392	0.0017034751165589																												
285	SRP-dependent cotranslational protein targeting to membrane (GO:0006614)	-2.0748956732536974	0.0017886488723869																												
286	positive regulation of cytokine production (GO:0001819)	-2.0829710761488385	0.0015581696165983																												
287	regulation of tumor necrosis factor production (GO:0032680)	-2.093344095715813	0.0011650203383362																												
288	protein targeting to ER (GO:0045047)	-2.0956935397012084	0.0012335509464737																												
289	regulation of B cell proliferation (GO:0030888)	-2.099489508664826	0.0013106478806283																												
290	regulation of B cell receptor signaling pathway (GO:0050855)	-2.107747552645713	0.0012335509464737																												
291	positive regulation of phagocytosis (GO:0050766)	-2.1173888165645893	0.0011454401645827																												
292	B cell activation (GO:0042113)	-2.118593908628316	0.0011386624121295																												
293	vascular endothelial growth factor receptor signaling pathway (GO:0048010)	-2.1446430926061373	0.0003083877366184																												
294	neutrophil mediated immunity (GO:0002446)	-2.172714604197039	0.0002242819902679																												
295	innate immune response (GO:0045087)	-2.175097559977503	0.0002467101892947																												
296	neutrophil degranulation (GO:0043312)	-2.178393602422382	0.0002741224325497																												
297	Fc receptor mediated stimulatory signaling pathway (GO:0002431)	-2.1825757747598877	0.0003083877366184																												
298	neutrophil activation involved in immune response (GO:0002283)	-2.1874510415017823	0.0001762215637819																												
299	Fc-gamma receptor signaling pathway involved in phagocytosis (GO:0038096)	-2.1931071491598235	0.0002055918244122																												
300	toll-like receptor signaling pathway (GO:0002224)	-2.2001624148833283	0.0002467101892947																												
301	Fc-gamma receptor signaling pathway (GO:0038094)	-2.209565523846853	0.0003083877366184																												
302	B cell receptor signaling pathway (GO:0050853)	-2.210769062236825	0.0004111836488245																												
303	pattern recognition receptor signaling pathway (GO:0002221)	-2.2728765957770256	0.0																												
304	regulation of cytokine-mediated signaling pathway (GO:0001959)	-2.276130450173208	0.0																												
