MeV.1.4.1.index	MeV.1.4.1.Term	MeV.1.4.1.NES	MeV.1.4.1.FDR q-val	MeV.1.4.11.index	MeV.1.4.11.Term	MeV.1.4.11.NES	MeV.1.4.11.FDR q-val	MeV.1.4.13.index	MeV.1.4.13.Term	MeV.1.4.13.NES	MeV.1.4.13.FDR q-val	MeV.1.4.15.index	MeV.1.4.15.Term	MeV.1.4.15.NES	MeV.1.4.15.FDR q-val	MeV.1.4.2.index	MeV.1.4.2.Term	MeV.1.4.2.NES	MeV.1.4.2.FDR q-val	MeV.1.4.21.index	MeV.1.4.21.Term	MeV.1.4.21.NES	MeV.1.4.21.FDR q-val	MeV.1.4.4.index	MeV.1.4.4.Term	MeV.1.4.4.NES	MeV.1.4.4.FDR q-val	MeV.1.4.5.index	MeV.1.4.5.Term	MeV.1.4.5.NES	MeV.1.4.5.FDR q-val	MeV.1.4.6.index	MeV.1.4.6.Term	MeV.1.4.6.NES	MeV.1.4.6.FDR q-val	MeV.1.4.7.index	MeV.1.4.7.Term	MeV.1.4.7.NES	MeV.1.4.7.FDR q-val	MeV.1.4.8.index	MeV.1.4.8.Term	MeV.1.4.8.NES	MeV.1.4.8.FDR q-val	MeV.2.1.index	MeV.2.1.Term	MeV.2.1.NES	MeV.2.1.FDR q-val	MeV.2.8.index	MeV.2.8.Term	MeV.2.8.NES	MeV.2.8.FDR q-val	MeV.3.17.index	MeV.3.17.Term	MeV.3.17.NES	MeV.3.17.FDR q-val	MeV.3.30.index	MeV.3.30.Term	MeV.3.30.NES	MeV.3.30.FDR q-val	MeV.4.1.index	MeV.4.1.Term	MeV.4.1.NES	MeV.4.1.FDR q-val	MeV.4.21.index	MeV.4.21.Term	MeV.4.21.NES	MeV.4.21.FDR q-val	MeV.4.26.index	MeV.4.26.Term	MeV.4.26.NES	MeV.4.26.FDR q-val	MeV.4.30.index	MeV.4.30.Term	MeV.4.30.NES	MeV.4.30.FDR q-val	MeV.4.31.index	MeV.4.31.Term	MeV.4.31.NES	MeV.4.31.FDR q-val	MeV.4.4.index	MeV.4.4.Term	MeV.4.4.NES	MeV.4.4.FDR q-val	MeV.NA.index	MeV.NA.Term	MeV.NA.NES	MeV.NA.FDR q-val
0.0	postsynaptic density membrane (GO:0098839)	-1.839344824694075	0.020835526546654	0.0	collagen-containing extracellular matrix (GO:0062023)	-1.7416008802549563	0.0492411372411372	0.0	acrosomal vesicle (GO:0001669)	2.183061586958604	0.0	0.0	voltage-gated potassium channel complex (GO:0008076)	2.395291826942338	0.0	0.0	voltage-gated potassium channel complex (GO:0008076)	2.49370601406952	0.0	0.0	tertiary granule membrane (GO:0070821)	1.8865130769552092	0.0066663729440831	0.0	integral component of postsynaptic specialization membrane (GO:0099060)	-1.6925729362806208	0.0454137440801951	0.0	microvillus (GO:0005902)	1.9281409951001507	0.0323404561479243	0.0	cell-cell junction (GO:0005911)	-1.8309713464625144	0.0251925541956427	0.0	basement membrane (GO:0005604)	2.060870134157072	0.0041359638697409	0	cytosolic large ribosomal subunit (GO:0022625)	2.586205165849768	0.0	0.0	supramolecular fiber (GO:0099512)	2.0742351065500264	0.0077427837498934	0.0	collagen-containing extracellular matrix (GO:0062023)	2.139722252570735	0.0	0.0	basement membrane (GO:0005604)	2.21033022739652	0.0	0.0	spindle microtubule (GO:0005876)	2.089115304950164	0.0	0.0	ion channel complex (GO:0034702)	2.112007112175101	0.0008962050352301	0.0	microvillus (GO:0005902)	2.018027449610748	0.0059595229203251	0.0	apical junction complex (GO:0043296)	2.032400295654835	0.0162354349010071	0.0	NADPH oxidase complex (GO:0043020)	1.9296557705711777	0.0080937733130307	0.0	myofibril (GO:0030016)	2.263844686637366	0.0	0.0	ribosome (GO:0005840)	-1.829286320214342	0.0277641524487178	0.0	collagen-containing extracellular matrix (GO:0062023)	2.071645205127581	0.0
1.0	postsynaptic specialization membrane (GO:0099634)	-1.8443672397301525	0.0238025055268975	1.0	caveola (GO:0005901)	-1.7798852239774952	0.0336752976752976	1.0	anchored component of plasma membrane (GO:0046658)	2.1414977513703923	0.0	1.0	cytosolic small ribosomal subunit (GO:0022627)	2.3673245648651093	0.0	1.0	potassium channel complex (GO:0034705)	2.417287486749551	0.0	1.0	phagocytic vesicle (GO:0045335)	1.8719359949602057	0.0052378644560653	1.0	cell-cell junction (GO:0005911)	-1.7189140377888597	0.0358358889633166	1.0	collagen-containing extracellular matrix (GO:0062023)	-2.095045197786509	0.0009209314563873	1.0	cell-substrate junction (GO:0030055)	-1.934439431295902	0.0049909777180046	1.0	collagen-containing extracellular matrix (GO:0062023)	1.9280884573391557	0.0289517470881863	1	large ribosomal subunit (GO:0015934)	2.5746600060450424	0.0	1.0	basement membrane (GO:0005604)	1.8805793275328595	0.0433918505983613	1.0	basement membrane (GO:0005604)	2.123450373061558	0.0	1.0	large ribosomal subunit (GO:0015934)	-1.9881851886021973	0.0088715853969874	1.0	mitotic spindle (GO:0072686)	2.0290255008423164	0.0	1.0	cation channel complex (GO:0034703)	2.03439734073224	0.0103063579051464					1.0	tight junction (GO:0070160)	1.9525455319693052	0.045841227955785					1.0	sarcoplasmic reticulum (GO:0016529)	2.1382669687752576	0.0	1.0	integral component of postsynaptic specialization membrane (GO:0099060)	-1.8319504251484195	0.0322053530798825	1.0	endoplasmic reticulum lumen (GO:0005788)	1.9085680207948093	0.0129069501475858
2.0	microfibril (GO:0001527)	-1.855765198493084	0.0250026318559848	2.0	adherens junction (GO:0005912)	-1.7997126518805815	0.0283046683046683	2.0	platelet dense granule (GO:0042827)	-1.8292060012954328	0.02937290330815	2.0	postsynaptic density (GO:0014069)	2.3371607355642454	0.0	2.0	ionotropic glutamate receptor complex (GO:0008328)	2.337837722384618	0.0	2.0	ficolin-1-rich granule membrane (GO:0101003)	1.868571349831089	0.0034919096373768	2.0	focal adhesion (GO:0005925)	-1.766106393764199	0.0205180748508039					2.0	focal adhesion (GO:0005925)	-1.9589877959415192	0.0036668407724116	2.0	postsynaptic specialization membrane (GO:0099634)	-1.7603703659603387	0.0314809470365025	2	ribosome (GO:0005840)	2.531585016922369	0.0	2.0	proton-transporting ATP synthase complex (GO:0045259)	-1.7212807809084247	0.0477482624012187	2.0	supramolecular fiber (GO:0099512)	2.115987599761626	0.0	2.0	small ribosomal subunit (GO:0015935)	-2.0011667896720327	0.009294041844463	2.0	condensed chromosome (GO:0000793)	2.0133982739435647	0.0	2.0	ribosome (GO:0005840)	-1.8311995813500743	0.0171590545085686					2.0	bicellular tight junction (GO:0005923)	1.9409694116141825	0.0391560488788996					2.0	muscle myosin complex (GO:0005859)	2.0858083842750363	0.0005643818607669	2.0	connexin complex (GO:0005922)	-1.832601735606997	0.037976254498821				
3.0	lysosomal lumen (GO:0043202)	-1.8896825145009617	0.0196687370600414	3.0	actin cytoskeleton (GO:0015629)	-1.809199368592266	0.0285905740451195	3.0	ribosome (GO:0005840)	-1.866076707664626	0.0204371706752489	3.0	asymmetric synapse (GO:0032279)	2.3344226566756023	0.0	3.0	postsynaptic specialization membrane (GO:0099634)	2.174533951272135	0.000202250496433	3.0	T cell receptor complex (GO:0042101)	1.8435858515939527	0.0045236102120564	3.0	cell-substrate junction (GO:0030055)	-1.7755881880638225	0.0185424955075841					3.0	polysomal ribosome (GO:0042788)	-2.295424212711556	0.0	3.0	postsynaptic density membrane (GO:0098839)	-1.7990082804530705	0.0209943883277216	3	small ribosomal subunit (GO:0015935)	2.423278108795304	0.0	3.0	tight junction (GO:0070160)	-1.7558406846555763	0.0361698605593207	3.0	microfibril (GO:0001527)	1.923117366282613	0.0070902605994362	3.0	cytosolic small ribosomal subunit (GO:0022627)	-2.0819355469868324	0.0025347386848535	3.0	spindle (GO:0005819)	1.996754463529286	0.0001727442551684	3.0	supramolecular fiber (GO:0099512)	-1.845369760157248	0.015558623214381					3.0	platelet dense granule (GO:0042827)	-1.9755400373835923	0.0422100535581333					3.0	sarcoplasmic reticulum membrane (GO:0033017)	2.065761872050613	0.0016931455823009	3.0	cytosolic small ribosomal subunit (GO:0022627)	-1.8993231240826411	0.0145203326024903				
4.0	collagen-containing extracellular matrix (GO:0062023)	-1.890060847087471	0.0295031055900621	4.0	cytoplasmic side of endoplasmic reticulum membrane (GO:0098554)	-1.942817051187161	0.0059125307125307	4.0	polysomal ribosome (GO:0042788)	-1.8661466461606055	0.0245246048102987	4.0	ionotropic glutamate receptor complex (GO:0008328)	2.3040943353526764	0.0	4.0	postsynaptic density membrane (GO:0098839)	2.168706451129145	0.0001618003971464	4.0	azurophil granule lumen (GO:0035578)	1.7825340940561625	0.0144755526785805	4.0	sodium channel complex (GO:0034706)	-1.7967975133930771	0.0153058084841095					4.0	ribosome (GO:0005840)	-2.52993162386209	0.0	4.0	excitatory synapse (GO:0060076)	-1.8071302298201464	0.0202185598676826	4	cytosolic small ribosomal subunit (GO:0022627)	2.416256477683509	0.0	4.0	microvillus membrane (GO:0031528)	-1.7917036665783297	0.0257796473734777	4.0	ribosome (GO:0005840)	-1.8014828764874415	0.0423431838205581	4.0	cytosolic large ribosomal subunit (GO:0022625)	-2.1151337630321314	0.0025347386848535	4.0	microtubule (GO:0005874)	1.9928555556023704	0.0001381954041347	4.0	platelet alpha granule lumen (GO:0031093)	-1.877321281105612	0.0094540245226273													4.0	actin filament (GO:0005884)	2.023461618532171	0.0025397183734514	4.0	small ribosomal subunit (GO:0015935)	-1.9295079913253277	0.0115418028378769				
				5.0	cell-cell junction (GO:0005911)	-2.0102591290650103	0.0018170898170898	5.0	large ribosomal subunit (GO:0015934)	-1.8878721998777697	0.0235337116866503	5.0	potassium channel complex (GO:0034705)	2.278774897934555	0.0	5.0	postsynaptic density (GO:0014069)	2.134343042299032	0.0002696673285773	5.0	endolysosome (GO:0036019)	1.7683701789399424	0.0168246555255431	5.0	voltage-gated potassium channel complex (GO:0008076)	-1.7983519530257022	0.0160079097907201					5.0	cytosolic small ribosomal subunit (GO:0022627)	-2.5843843897309933	0.0	5.0	AMPA glutamate receptor complex (GO:0032281)	-1.81558082786628	0.0192738080392401	5	polysomal ribosome (GO:0042788)	2.304405506828945	0.0	5.0	cell-cell junction (GO:0005911)	-1.8500793610430075	0.0111619314704147	5.0	glutamatergic synapse (GO:0098978)	-1.8026804945827424	0.0465852858761104					5.0	chromosome (GO:0005694)	1.9794173565430853	0.0002303256735579	5.0	cytosolic small ribosomal subunit (GO:0022627)	-1.881941503138816	0.0102103464844375													5.0	actin-based cell projection (GO:0098858)	2.0177004042600317	0.0021164319778762	5.0	large ribosomal subunit (GO:0015934)	-2.2692799138329613	0.0				
				6.0	polysomal ribosome (GO:0042788)	-2.145435817079875	0.0	6.0	cytosolic large ribosomal subunit (GO:0022625)	-1.9425519122367576	0.0136247804501659	6.0	neuron projection (GO:0043005)	2.277530346179449	0.0	6.0	AMPA glutamate receptor complex (GO:0032281)	2.1294760421160164	0.0003467151367423	6.0	lysosomal lumen (GO:0043202)	1.7627850460552636	0.0168700050013532	6.0	ion channel complex (GO:0034702)	-1.8054118263083665	0.0153016784764236					6.0	large ribosomal subunit (GO:0015934)	-2.602036862928406	0.0	6.0	dendrite membrane (GO:0032590)	-1.843022914967196	0.0141013622059373	6	proton-transporting ATP synthase complex (GO:0045259)	2.051318097165572	0.0	6.0	apical junction complex (GO:0043296)	-1.8542220002764345	0.0106962446294065	6.0	potassium channel complex (GO:0034705)	-1.818446411912768	0.0420318368807011					6.0	microtubule cytoskeleton (GO:0015630)	1.8749836120209116	0.006021371180157	6.0	small ribosomal subunit (GO:0015935)	-1.9170203464722444	0.006239656184934													6.0	actin cytoskeleton (GO:0015629)	1.9707989820880556	0.0056841315977247	6.0	cytosolic large ribosomal subunit (GO:0022625)	-2.292736739995937	0.0				
				7.0	cell-substrate junction (GO:0030055)	-2.2560615624911606	0.0	7.0	connexin complex (GO:0005922)	-1.9712341773729989	0.0154827050570068	7.0	small ribosomal subunit (GO:0015935)	2.277079851495638	0.0	7.0	neuron projection (GO:0043005)	2.126978850400284	0.0003033757446495	7.0	secretory granule membrane (GO:0030667)	1.7394007738077526	0.0241656019223013	7.0	dendrite (GO:0030425)	-1.822097078194134	0.0135066738859201					7.0	cytosolic large ribosomal subunit (GO:0022625)	-2.6021996625456025	0.0	7.0	axon (GO:0030424)	-1.869578311692555	0.0109811073699962	7	mitochondrial proton-transporting ATP synthase complex (GO:0005753)	2.041304976467332	0.0	7.0	adherens junction (GO:0005912)	-1.8606464878342437	0.0108150917919555	7.0	ion channel complex (GO:0034702)	-1.877848743498684	0.0214829388501361					7.0	condensed chromosome, centromeric region (GO:0000779)	1.864517737014936	0.0071688865894902	7.0	platelet alpha granule (GO:0031091)	-1.9394231365131347	0.0052942537326713													7.0	calcium channel complex (GO:0034704)	1.9604408318598996	0.0063492959336286								
				8.0	focal adhesion (GO:0005925)	-2.2744318405423094	0.0	8.0	gap junction (GO:0005921)	-2.0166363278862383	0.0136247804501659	8.0	cytosolic large ribosomal subunit (GO:0022625)	2.271300798416512	0.0	8.0	glutamatergic synapse (GO:0098978)	2.1203005830896977	0.0002696673285773	8.0	vacuolar lumen (GO:0005775)	1.7286959892811606	0.0276178307683443	8.0	catenin complex (GO:0016342)	-1.82957541067722	0.0134288576577707					8.0	small ribosomal subunit (GO:0015935)	-2.626481014003875	0.0	8.0	neuron projection (GO:0043005)	-2.009082374740019	0.0012904352163611	8	ficolin-1-rich granule lumen (GO:1904813)	1.990568192868538	0.0	8.0	caveola (GO:0005901)	-1.900073338963575	0.0055379690808529	8.0	small ribosomal subunit (GO:0015935)	-1.935043478622932	0.013169975555953					8.0	acrosomal vesicle (GO:0001669)	1.825506127014204	0.0206525353956933	8.0	large ribosomal subunit (GO:0015934)	-1.979361529955017	0.0034034488281458													8.0	filopodium (GO:0030175)	1.935000456193998	0.010817318998034								
				9.0	small ribosomal subunit (GO:0015935)	-2.331742191239638	0.0					9.0	GABA-A receptor complex (GO:1902711)	2.249596950022294	0.0	9.0	GABA-A receptor complex (GO:1902711)	2.0526277597578653	0.0008899021843053	9.0	tertiary granule (GO:0070820)	1.7271729981685646	0.0258083866835218	9.0	potassium channel complex (GO:0034705)	-1.8358640757134823	0.0123870730523429									9.0	glutamatergic synapse (GO:0098978)	-2.0319171878929407	0.0008508364063919	9	endocytic vesicle lumen (GO:0071682)	1.9895429258919173	0.0	9.0	focal adhesion (GO:0005925)	-1.9713183882361764	0.0014567266495287	9.0	polysomal ribosome (GO:0042788)	-1.9840732818851197	0.0108582245275144					9.0	nuclear chromosome (GO:0000228)	1.820654342021315	0.0210747991305495	9.0	cytosolic large ribosomal subunit (GO:0022625)	-1.9999032637459309	0.0056724147135764													9.0	sarcolemma (GO:0042383)	1.9299277497585037	0.010328188052036								
				10.0	ribosome (GO:0005840)	-2.33356329870234	0.0					10.0	dendrite membrane (GO:0032590)	2.2422860376807607	0.0	10.0	integral component of postsynaptic specialization membrane (GO:0099060)	2.037737322375793	0.0011767301610649	10.0	membrane raft (GO:0045121)	1.712495789719907	0.0322063731844016	10.0	axon (GO:0030424)	-1.8542755481626088	0.010261480635077									10.0	cation channel complex (GO:0034703)	-2.06336914158421	0.0002290713401824	10	endosome lumen (GO:0031904)	1.982946632447638	0.0	10.0	cell-substrate junction (GO:0030055)	-1.98343037616355	0.001324296954117	10.0	cytosolic small ribosomal subunit (GO:0022627)	-1.9933277028918597	0.0130765714739959					10.0	cyclin-dependent protein kinase holoenzyme complex (GO:0000307)	1.8203164967793009	0.0192845404860766																	10.0	cation channel complex (GO:0034703)	1.875882205046632	0.0262437565256652								
				11.0	cytosolic small ribosomal subunit (GO:0022627)	-2.3733463875257463	0.0					11.0	large ribosomal subunit (GO:0015934)	2.202604565831193	7.734324934057346e-05	11.0	cation channel complex (GO:0034703)	2.023087230916011	0.0014157534750312	11.0	ficolin-1-rich granule (GO:0101002)	1.709094798827561	0.0319033562323978	11.0	neuron projection (GO:0043005)	-1.8589068125299504	0.01033844173984									11.0	voltage-gated potassium channel complex (GO:0008076)	-2.0939799107299093	0.0001240803092654	11	ficolin-1-rich granule (GO:0101002)	1.9546072415254976	0.0	11.0	microvillus (GO:0005902)	-2.0152108740784453	0.0008276855963231	11.0	large ribosomal subunit (GO:0015934)	-2.477858384294816	0.0					11.0	postsynaptic density membrane (GO:0098839)	-1.972635317288593	0.0124281275668726																	11.0	beta-catenin-TCF complex (GO:1990907)	-1.9481908332394648	0.0223470674685483								
				12.0	large ribosomal subunit (GO:0015934)	-2.3808299633337557	0.0					12.0	dendrite (GO:0030425)	2.10877975391027	0.0001427875372441	12.0	asymmetric synapse (GO:0032279)	2.017683753708684	0.0014313112055261	12.0	podosome (GO:0002102)	1.7079147873620322	0.0299620498256043	12.0	GABA-A receptor complex (GO:1902711)	-1.8602087137558747	0.0110357559920873									12.0	potassium channel complex (GO:0034705)	-2.161056390127685	0.0001353603373805	12	respiratory chain complex I (GO:0045271)	1.934216128066225	7.243358745450265e-05	12.0	actin-based cell projection (GO:0098858)	-2.018767978324681	0.0007567411166382	12.0	cytosolic large ribosomal subunit (GO:0022625)	-2.511218483890252	0.0					12.0	small ribosomal subunit (GO:0015935)	-2.2577960840910145	0.0012945966215492																	12.0	endocytic vesicle lumen (GO:0071682)	-1.9568686969217703	0.0432974432203124								
				13.0	cytosolic large ribosomal subunit (GO:0022625)	-2.435151896371297	0.0					13.0	cation channel complex (GO:0034703)	2.0917505214718006	0.0003314710686024	13.0	dendrite membrane (GO:0032590)	1.9819031474077689	0.0028315069500625	13.0	NADPH oxidase complex (GO:0043020)	1.689993095415832	0.0389098502450566	13.0	dendrite membrane (GO:0032590)	-1.8777600252308768	0.008937749633152									13.0	ionotropic glutamate receptor complex (GO:0008328)	-2.1931229292332874	0.0	13	mitochondrial respiratory chain complex I (GO:0005747)	1.934216128066225	7.243358745450265e-05	13.0	polysomal ribosome (GO:0042788)	-2.4045825365635896	0.0									13.0	cytosolic small ribosomal subunit (GO:0022627)	-2.297378608683617	0.0008630644143661																												
												14.0	glutamatergic synapse (GO:0098978)	2.0790747961443854	0.0004331221963072	14.0	intrinsic component of postsynaptic density membrane (GO:0099146)	1.9505457656438296	0.0036910715599029	14.0	azurophil granule (GO:0042582)	1.6718969849600651	0.0476764707875945	14.0	polysomal ribosome (GO:0042788)	-1.9592963564480503	0.0025197635781689									14.0	postsynaptic density (GO:0014069)	-2.1964596702778945	0.0	14	tertiary granule lumen (GO:1904724)	1.908633344443018	6.760468162420247e-05	14.0	large ribosomal subunit (GO:0015934)	-2.482087626300245	0.0									14.0	large ribosomal subunit (GO:0015934)	-2.343531307868024	0.0																												
												15.0	AMPA glutamate receptor complex (GO:0032281)	2.034056774180857	0.000812104118076	15.0	integral component of postsynaptic density membrane (GO:0099061)	1.9505457656438296	0.0036910715599029	15.0	phagocytic vesicle membrane (GO:0030670)	1.670264271694374	0.0456562516758634	15.0	cation channel complex (GO:0034703)	-2.0184757642919946	0.00150074154288									15.0	dendrite (GO:0030425)	-2.22906307130438	0.0	15	cytoplasmic vesicle lumen (GO:0060205)	1.9065329410298268	6.337938902268981e-05	15.0	cytosolic large ribosomal subunit (GO:0022625)	-2.5439052400489186	0.0									15.0	cytosolic large ribosomal subunit (GO:0022625)	-2.422038778282173	0.0																												
												16.0	axon (GO:0030424)	2.024024192322025	0.0008735237572582	16.0	excitatory synapse (GO:0060076)	1.857976547690612	0.0120398530817784	16.0	endosome lumen (GO:0031904)	1.669103588538454	0.0440721322414384	16.0	ionotropic glutamate receptor complex (GO:0008328)	-2.030979853200904	0.00133399248256									16.0	asymmetric synapse (GO:0032279)	-2.303298277091571	0.0	16	secretory granule lumen (GO:0034774)	1.8820632109208268	0.000298255948342	16.0	small ribosomal subunit (GO:0015935)	-2.6216547979872087	0.0																																								
												17.0	excitatory synapse (GO:0060076)	2.0149776244164705	0.0008249946596327	17.0	catenin complex (GO:0016342)	1.8500363346675024	0.0127642535526627	17.0	vacuolar proton-transporting V-type ATPase complex (GO:0016471)	1.668046421993978	0.042554516011478	17.0	ribosome (GO:0005840)	-2.113248590048731	0.00066699624128									17.0	ribosome (GO:0005840)	-2.361271913688419	0.0	17	lysosomal lumen (GO:0043202)	1.861642788044424	0.0006197095815551	17.0	ribosome (GO:0005840)	-2.6273297997197256	0.0																																								
												18.0	integral component of plasma membrane (GO:0005887)	1.9081502260147083	0.0036147792323383	18.0	axon (GO:0030424)	1.8344710997688176	0.0141362452243722	18.0	lamellar body (GO:0042599)	1.6583988675707846	0.046759844507783	18.0	small ribosomal subunit (GO:0015935)	-2.206173592091251	0.0									18.0	polysomal ribosome (GO:0042788)	-2.393808360426544	0.0	18	high-density lipoprotein particle (GO:0034364)	1.8549766997944717	0.0008539538731478	18.0	cytosolic small ribosomal subunit (GO:0022627)	-2.630760057171339	0.0																																								
												19.0	postsynaptic density membrane (GO:0098839)	1.788760165031609	0.0174950430008377	19.0	exocytic vesicle membrane (GO:0099501)	1.8049120497640052	0.0172201851248699					19.0	glutamatergic synapse (GO:0098978)	-2.2612223136081546	0.0									19.0	small ribosomal subunit (GO:0015935)	-2.533366339493278	0.0	19	vacuolar lumen (GO:0005775)	1.853549814739376	0.0008619596907085																																												
												20.0	postsynaptic specialization membrane (GO:0099634)	1.7864827921610886	0.0171039071398868	20.0	synaptic vesicle membrane (GO:0030672)	1.8049120497640052	0.0172201851248699					20.0	cytosolic small ribosomal subunit (GO:0022627)	-2.361383338122128	0.0									20.0	large ribosomal subunit (GO:0015934)	-2.5634909678206115	0.0	20	very-low-density lipoprotein particle (GO:0034361)	1.8126369667801971	0.0024429873586927																																												
												21.0	catenin complex (GO:0016342)	1.7753735349307014	0.0180561331187811	21.0	GABA-ergic synapse (GO:0098982)	1.8031930455753065	0.0167684047951754					21.0	large ribosomal subunit (GO:0015934)	-2.4281075405823898	0.0									21.0	cytosolic large ribosomal subunit (GO:0022625)	-2.573089832746867	0.0	21	triglyceride-rich plasma lipoprotein particle (GO:0034385)	1.8126369667801971	0.0024429873586927																																												
												22.0	anchored component of external side of plasma membrane (GO:0031362)	1.707540441445469	0.0368019356862276	22.0	dendrite (GO:0030425)	1.775677167595798	0.0211747476265544					22.0	cytosolic large ribosomal subunit (GO:0022625)	-2.478802238801042	0.0									22.0	cytosolic small ribosomal subunit (GO:0022627)	-2.6439732626670853	0.0	22	azurophil granule (GO:0042582)	1.8107555987746629	0.0026894905950497																																												
												23.0	basement membrane (GO:0005604)	-1.8525076692301508	0.0298753881834977	23.0	sodium channel complex (GO:0034706)	1.7242341760943496	0.0332364982471623																					23	rough endoplasmic reticulum (GO:0005791)	1.804610180930605	0.0029154518950437																																												
												24.0	endoplasmic reticulum lumen (GO:0005788)	-1.860196501722395	0.0355659383136878	24.0	voltage-gated sodium channel complex (GO:0001518)	1.7045106860614094	0.037926013091123																					24	asymmetric synapse (GO:0032279)	1.7934117799103992	0.0034478387628343																																												
												25.0	supramolecular fiber (GO:0099512)	-1.8906953082882687	0.0293418991087924	25.0	voltage-gated calcium channel complex (GO:0005891)	1.678447175570519	0.0451485338960517																					25	azurophil granule membrane (GO:0035577)	1.7887240157065938	0.0036272511871447																																												
												26.0	collagen-containing extracellular matrix (GO:0062023)	-2.035360723725584	0.008535825195285	26.0	SWI/SNF complex (GO:0016514)	-1.8415107623901932	0.0478841040358375																					26	mitochondrial inner membrane (GO:0005743)	1.7882496968788693	0.0035304667070416																																												
																27.0	cell-substrate junction (GO:0030055)	-2.0078773580259117	0.0080284725329547																					27	tertiary granule (GO:0070820)	1.7881624751038896	0.0034043786103616																																												
																28.0	focal adhesion (GO:0005925)	-2.0434809460166257	0.0091753971805197																					28	postsynaptic density (GO:0014069)	1.7636254139715246	0.0052451908156708																																												
																																								29	multivesicular body (GO:0005771)	1.75354124760409	0.0060844213461782																																												
																																								30	focal adhesion (GO:0005925)	1.7499151933385693	0.0063788288306707																																												
																																								31	azurophil granule lumen (GO:0035578)	1.748152458370644	0.0063379389022689																																												
																																								32	cell-substrate junction (GO:0030055)	1.7460057856703426	0.0063302565520844																																												
																																								33	organelle inner membrane (GO:0019866)	1.7339475578034054	0.0077248290620596																																												
																																								34	clathrin-coated endocytic vesicle (GO:0045334)	1.733076375481795	0.0076489868351954																																												
																																								35	endolysosome (GO:0036019)	1.727627227851032	0.0081125617949042																																												
																																								36	glutamatergic synapse (GO:0098978)	1.7191136983113708	0.0090170028058226																																												
																																								37	mitochondrial ribosome (GO:0005761)	1.718686987283382	0.0088330853753727																																												
																																								38	mitochondrial membrane (GO:0031966)	1.711765012491174	0.0099586896392575																																												
																																								39	lamellar body (GO:0042599)	1.7056288285887784	0.0105970338445937																																												
																																								40	muscle myosin complex (GO:0005859)	1.7039475700975542	0.0105611703854394																																												
																																								41	ficolin-1-rich granule membrane (GO:0101003)	1.6820607069974582	0.0150661861905365																																												
